{"$schema":"https://json-schema.org/draft/2020-12/schema","$id":"CTR-NTF-001","title":"Notification Command and Result","type":"object","additionalProperties":false,"required":["kind","notification_id","dedupe_key","locale","tenant_context"],"properties":{"kind":{"enum":["command","result"],"x-source":"PT-007 requires a channel-neutral COMMAND and RESULT pair."},"notification_id":{"type":"string","minLength":1,"x-source":"DECLARED INFERENCE, previously UNSOURCED. PT-007 requires a command/result pair, which needs an identity linking the two; no cited task names an id field. Independent review found this shipped with no source while ten siblings had one -- the same defect CTR-OBS-001 records as already corrected for its trace_id, three directories away in this catalog.","maxLength":128,"x-bound-note":"Bounded 2026-10-07 under open_blockers[13] (C0 N-6; RFC-2026-009 R-4 lists it among the 49 unbounded reference-shaped fields), because A1 measured a 1,000,000-character value ACCEPTED on its siblings (A1-S3). No baseline task states a length limit for any reference (RFC-2026-009 R-2), so THE BOUND IS A DECLARED INFERENCE, taken from RFC-2026-009's values for the same class: 128 for an id, 256 for a `scheme:path` reference. An id: 128, the bound CTR-EVT-001.event_id, CTR-JOB-001.job_id and CTR-API-001.request_id carry. It bounds LENGTH, not content: an id is opaque by design (RFC-2026-009 R-5), so a name or an email address of 128 characters or fewer still validates. A1-S3 measured exactly that; it is recorded under this manifest's untestable_by_schema and a character class for the id is left to A5."},"channel":{"enum":["in_app","email","line"],"x-source":"PT-007 Inputs: 'in-app first; email/LINE future'. Listing the two future channels is a DECLARED INFERENCE -- PT-007 names them as future, so a contract that omitted them would have to change to add them."},"message_key":{"type":"string","pattern":"^notification\\.[a-z_.]+$","x-source":"PT-007 requires locale support, and CTR-ERR-001 establishes a Thai message KEY rather than prose for user-facing text. DECLARED INFERENCE from that precedent.","maxLength":128,"x-bound-note":"Bounded 2026-10-07 under open_blockers[13] (C0 N-6; RFC-2026-009 R-4 lists it among the 49 unbounded reference-shaped fields), because A1 measured a 1,000,000-character value ACCEPTED on its siblings (A1-S3). No baseline task states a length limit for any reference (RFC-2026-009 R-2), so THE BOUND IS A DECLARED INFERENCE, taken from RFC-2026-009's values for the same class: 128 for an id, 256 for a `scheme:path` reference. A message key is a KEY into a localized message catalog, not a reference, so neither class fits it exactly; it takes 128, the id bound, because it is a dotted identifier that names one catalog entry, and the longest one any fixture uses is 29 characters. The pattern already keeps it to lowercase letters, `_` and `.`, so it cannot carry a contact detail."},"locale":{"enum":["th-TH"],"x-source":"Section 3.1: Phase 1 locale default is th-TH. Only the supported locale is listed, so adding one is a visible contract change."},"deep_link":{"type":"object","additionalProperties":false,"required":["target_ref","requires_permission"],"properties":{"target_ref":{"type":"string","pattern":"^(app|content|asset|job):[A-Za-z0-9_-]+(?:\\.[A-Za-z0-9_-]+)*(?:/[A-Za-z0-9_-]+(?:\\.[A-Za-z0-9_-]+)*)*$","maxLength":256,"x-bound-note":"Bounded 2026-10-07 under open_blockers[13] (C0 N-6; RFC-2026-009 R-4 lists it among the 49 unbounded reference-shaped fields), because A1 measured a 1,000,000-character value ACCEPTED on its siblings (A1-S3). No baseline task states a length limit for any reference (RFC-2026-009 R-2), so THE BOUND IS A DECLARED INFERENCE, taken from RFC-2026-009's values for the same class: 128 for an id, 256 for a `scheme:path` reference. A `scheme:path` reference: 256, the bound on CTR-IDM-001.result_ref, CTR-JOB-001.input_ref/result_ref and CTR-API-001.deep_link_ref, whose grammar this field adopts. 256 is also the length the database enforces on those references (RFC-2026-009 R-2), so a deep link can name anything they can."},"requires_permission":{"const":true}},"x-source":"PT-007 requires deep-link support, and CTR-NTF-001's own catalog row requires a 'permission-checked deep link'. requires_permission is const true because a deep link that does not demand a permission check is the defect the row names. The target_ref grammar is the catalog reference form adopted from CTR-IDM-001. `requires_permission` is in `required` as well as `const true`, because a const never fires on an ABSENT property: without the requirement the permission check failed open silently. Independent testing found it."},"dedupe_key":{"type":"string","minLength":1,"x-source":"ID-005 notification dedupe strategy: a completed or retried event must not notify a user twice beyond policy. PT-007 requires dedupe support.","maxLength":128,"pattern":"^ntf:[A-Za-z0-9_-]+(?::[A-Za-z0-9_.-]+)*$","x-bound-note":"Bounded 2026-10-07 under open_blockers[13] (C0 N-6; RFC-2026-009 R-4 lists it among the 49 unbounded reference-shaped fields), because A1 measured a 1,000,000-character value ACCEPTED on its siblings (A1-S3). No baseline task states a length limit for any reference (RFC-2026-009 R-2), so THE BOUND IS A DECLARED INFERENCE, taken from RFC-2026-009's values for the same class: 128 for an id, 256 for a `scheme:path` reference. A dedupe key: 128, the bound on CTR-JOB-001.dedupe_key, the other dedupe key RFC-2026-009 bounded (R-2: '128 on the ids and dedupe_key'). CTR-USG-001's dedupe_key carries 512 because its composition embeds two ids, a dimension, a basis and an instant; this key has no stated composition to size against, so it takes the class bound. SIZING LIMIT, declared 2026-10-07 for C0 F-1 and Q0 Q-4 (evidence/WP-0A-CON-006/c0-review-2026-10-07.md, q0-review-2026-10-07.md), measured: the shape the shipped fixtures use, `ntf:<source id>:<event>`, does NOT fit every id this contract admits. (a) LENGTH: with `:approved` as the event, the longest source id that fits is 115 characters, so a key built from an id at its own 128 bound is 141 characters and is rejected. (b) CLASS: the first segment admits ASCII letters, digits, `_` and `-` only, while deep_link.target_ref admits `.` inside a segment, so a valid target_ref such as `content:content.v2` yields `ntf:content.v2:approved`, which is rejected. Neither the bound nor the class is changed here, because the key's composition is ID-005's dedupe key policy and A5's decision (open_blockers[22]): A5's composition must be sized against this 128 bound and this class, or must change them with it. Until then a producer cannot build this shape from a long or dotted id, and that is recorded, not hidden.","x-pii-shape":"A1-S3 / SC-3, 2026-10-07. A1 measured this key ACCEPTING an email address and a phone number, and a key sits in a dedupe store for the whole dedupe window, so it must not be able to carry a contact detail. CHARACTER CLASS, enforced by the pattern: the literal namespace `ntf:`, then one or more `:`-separated segments of ASCII letters, digits, `_` and `-` (later segments may also hold `.`, so a message-key fragment such as `content.approved` fits). It has no `@`, no `+`, no whitespace and no `/`, so an email address, an E.164 phone number and a spaced name are rejected. WHAT IT DOES NOT DO, recorded rather than hidden: a bare run of digits such as a local phone number is still admitted, because the opaque ids a key is built from are themselves digits and letters. The full COMPOSITION -- which ids and which event make up a key -- is ID-005's `dedupe key policy` and is A5's decision; it is NOT stated here, and the manifest's untestable_by_schema records it as owed. DECLARED INFERENCE: the `ntf:` namespace follows CTR-USG-001's `usg:` and the shipped fixtures, which already use `ntf:<source id>:<event>`."},"delivery":{"type":"object","additionalProperties":false,"required":["state"],"properties":{"state":{"enum":["queued","delivered","failed","suppressed_duplicate"],"x-source":"DECLARED INFERENCE. PT-007 names no state machine. `queued`, `delivered` and `failed` are this contract's own terms; `suppressed_duplicate` is inferred from ID-005, which requires a completed or retried event not to notify a user twice beyond policy -- a suppression that is invisible in the result cannot be audited."},"failure_class":{"enum":["transient","permanent"]}},"x-source":"PT-007 requires a channel-neutral result and CT-007 requires transient and permanent failure to be distinguishable. An earlier version carried `domain_result_rolled_back: const false`. That was a CATEGORY ERROR, found by independent review: it asserted what a DIFFERENT subsystem did, so if a rollback actually occurred the truthful report became schema-invalid -- suppressing the evidence rather than preventing the violation. Decision Register 4.2 already places that prohibition where it belongs: MOD-100's \u0e2b\u0e49\u0e32\u0e21\u0e17\u0e33 column reads 'roll back domain result on delivery failure', on A5's own module. A contract describing one notification cannot enforce it."},"tenant_context":{"$ref":"../ctr-ten-001/schema.json","x-source":"Section 3.1: every command touching customer data carries the Trusted Tenant Context."}},"allOf":[{"if":{"properties":{"kind":{"const":"command"}},"required":["kind"]},"then":{"required":["channel","message_key","deep_link"],"not":{"required":["delivery"]}},"x-rule":"PT-007: a channel-neutral COMMAND names its channel, its localized message key and its permission-checked deep link, and carries no delivery state -- that belongs to the result."},{"if":{"properties":{"kind":{"const":"result"}},"required":["kind"]},"then":{"required":["delivery"]},"x-rule":"PT-007: a RESULT reports delivery."},{"if":{"properties":{"delivery":{"properties":{"state":{"const":"failed"}},"required":["state"]}},"required":["delivery"]},"then":{"properties":{"delivery":{"required":["state","failure_class"]}}},"x-rule":"CT-007 requires transient and permanent failure to be distinguishable; a failure stating neither is unusable to a retry policy. The rollback flag was removed from this rule -- see delivery.x-source."},{"if":{"properties":{"delivery":{"properties":{"state":{"const":"delivered"}},"required":["state"]}},"required":["delivery"]},"then":{"properties":{"delivery":{"not":{"required":["failure_class"]}}}},"x-rule":"A delivered notification cannot carry a failure class. Independent testing found `state: delivered` with `failure_class: permanent` accepted."}]}
