{"kind":"result","notification_id":"ntf_synthetic_0001","locale":"th-TH","dedupe_key":"ntf:content_synthetic_0001:approved","tenant_context":{"workspace_id":"00000000-0000-4000-8000-000000000001","business_profile_id":"00000000-0000-4000-8000-000000000002","page_context_profile_id":"00000000-0000-4000-8000-000000000003","actor":{"kind":"user","id":"00000000-0000-4000-8000-000000000004"},"request_id":"00000000-0000-4000-8000-000000000005","correlation_id":"00000000-0000-4000-8000-000000000006","locale":"th-TH","timezone":"Asia/Bangkok"},"delivery":{"state":"delivered"}}
